{
  "id": "https://veridium.io/vnt/tok_chain_example",
  "type": "VerifiableCredential",
  "credentialSubject": {
    "claim": {
      "subject": "Elebia EVO10 Hook",
      "predicate": "has maximum working load",
      "object": "10,000 kg"
    },
    "contentHash": "0xecf633e50d1a7483e126ba80ebce601e1da752ddee91c8a46ef0dd55ac469b3a"
  },
  "issuer": {
    "id": "did:key:z6MkhaXgBZDvotDkL5257faiztiGiC2QtKLGpbnnEGta2doK",
    "name": "Veridium",
    "tier": "gold"
  },
  "proof": {
    "type": "Ed25519Signature2020",
    "proofPurpose": "assertionMethod",
    "verificationMethod": "did:key:z6MkhaXgBZDvotDkL5257faiztiGiC2QtKLGpbnnEGta2doK",
    "created": "2025-01-15T13:00:00Z",
    "proofValue": "z4sZmLmMbvJqRw1PjL7hC7vN9Kk9Xx4Zx3Xx3Xx3Xx3Xx3Xx3Xx3Xx3Xx3Xx3Xx3Xx3"
  },
  "signatureTimestamp": "2025-01-15T13:00:00Z",
  "verificationMethod": "human-expert",
  "verificationScore": 0.99,
  "expirationDate": "2026-01-15T13:00:00Z",
  "blockchainAnchor": {
    "network": "Sepolia",
    "txHash": "0xabcd1234abcd1234abcd1234abcd1234abcd1234abcd1234abcd1234abcd1234",
    "blockNumber": 5678901,
    "timestamp": "2025-01-15T13:05:00Z"
  }
}
