{
  "id": "https://veridium.io/vnt/tok_gold_example",
  "type": "VerifiableCredential",
  "credentialSubject": {
    "claim": {
      "subject": "Elebia EVO10 Hook",
      "predicate": "has maximum working load",
      "object": "10,000 kg"
    },
    "contentHash": "0x32ac18f96e22b7550bcc850132db32c5948ec4c496120dc19c962218c5796dde"
  },
  "issuer": {
    "id": "did:key:z6MkneMkZqwqRiU5mJzSG3kDwzt9P8C59N4NGTfBLfSGE7c7",
    "name": "Veridium",
    "tier": "gold"
  },
  "signatureTimestamp": "2025-01-15T10:00:00Z",
  "verificationMethod": "human-expert",
  "verificationScore": 0.98,
  "expirationDate": "2027-01-15T10:00:00Z",
  "proof": {
    "type": "Ed25519Signature2020",
    "proofPurpose": "assertionMethod",
    "verificationMethod": "did:key:z6MkneMkZqwqRiU5mJzSG3kDwzt9P8C59N4NGTfBLfSGE7c7",
    "created": "2025-01-15T10:00:00Z",
    "proofValue": "z5v9tYwqAMJy1aiaam2fDTE73Se9kRRDJMroqkESqqnWyrrDmeZtnjKfYnzR6VN1jpRhLpmaR7aX2TixGm1u56xbD"
  }
}
